	city	raw_text	clean_text	cluster_id
positioned to move into the “park-n-charge” business and proposes to do so. The City
would also seek to facilitate similar installations at key private parking facilities and
employers, and at Tide park-n-ride lots. The City would determine ways to leverage the
increased power supply infrastructure needed in garages, for other uses, and use
smartgrid technology to manage peak loading, perhaps even employ some form of
reverse generation.
NINE
Connected,
Involved
CitizensAs part of this proposal, the City and its partners will develop a customizable app
toward an “Intelligent Community Platform”, that will provide citizens, city
departments, businesses, military and other organization access to targeted and
actionable information that enhances their ability to make smart decisions that allow
them to survive, adapt and grow in the face of the city’s challenges. The app will help
avoid congestion; improve safety and mobility, route around and otherwise mitigate the
impacts of flooded areas; optimize business operations, and connect vulnerable
residents to services in times of disruption. The City will leverage its vast network of
non-profit, public and private partnerships and build upon existing community
engagement campaigns and crowdsourcing efforts to make citizens active participants
in the designing community of the future, asking them to be aware, involved and take a
smart action in a more risky coastal environment.
TEN
Architecture and
StandardsPart of our Vision is to produce as much value as possible, both for Norfolk and the
Country. Our approach described in Section 10, and the qualifications of our team,
demonstrates our capabilities and commitment to this element.
ELEVEN
Low-Cost,
Efficient,
Secure, and
Resilient
Information and
Communication
TechnologyOur vision is to move beyond traffic to an integrated next -generation digital
infrastructure that can deliver solutions and services to its residents. The City’s existing
fiber-optic-plant based Wide Area Network and ATMS Network, with ongoing
expansions and upgrades, aligns well with this vision element and serves as the
backbone of our system. The City will make its Smart City services and information
accessible online at any time, from anywhere. The information will be accessed by a
website or application with real-time updates from the transportation and Smart City
network. Data will be presented through open web services to appropriate users in
secure, PII protected manner. The City’s digital infrastructure will not only connect to
what resides in the City’s data center, but also extended through the “internet of
things” to residents’ smart phones, wearable devices, cars, tablets, and PCs, etc. The
City’s digital infrastructure will be upgraded and expanded to increase its capacity for
public Wi-Fi, internet service to residents and businesses, sensors, analytics, security,
storage, and computing.
Operations that were in silos will now be connected to a centralized command and-
City of Norfolk Page 19Vision
ElementAlignment and Approach
Low-Cost,
Efficient,
Secure, and
Resilient
Information and
Communication
Technologycontrol center, with communications and informati on flowing seamlessly across the
system through a government convergence platform and robust fiber optic network.
This will make possible multi-agency efforts, such as emergency notification and
dispatch services via departments of health, transportation, and safety. A security plan
will also be extended to fully cover all smart services used by the City, taking into
account all perimeter access points to ensure proper controls and privacy are
maintained. The City will also develop big data openness strategy to mine information
collected to make better data driven decisions, optimize operations, ensure effective
citizen engagement, and cross-government collaboration.
We will develop customized traffic congestion alert services, flooded roadway warning
systems, and critical infrastructure monitoring. Citizens can express preferences for
specific locations and delivery methods, such as receiving flooded road and parking
warnings or congestion updates for their specific frequent routes via push notifications,
text, and email, etc. Agencies can prioritize users, such as emergency vehicles or critical
infrastructure equipment. Targeted communications campaigns can be developed to
different categories of residents, driven by their work and personal lifestyles, to
increase smart services uptake and facilitate forums for continuous resident
engagement in services improvement.
We will conduct sophisticated data collection and analytics to enable The City to
develop predictive insights for anticipatory actions. Data collection and analytics will
allow the City during “blue skies” to better understand and model the impacts of sea-
level rise and flooding on its transportation and critical infrastructure, and the impact it
has on the citizens. This could also involve an analytics program that evaluates current
road and transit patterns to predict future usage, guiding informed decisions for
maintenance and expansion projects to City officials.
TWELVE
Smart
Land UseIncenting, facilitating and investing in business and land development, and livability -
supporting services and infrastructure, will create the future of Norfolk as a Smart City,
with a focus on people and accessibility. The recent past has seen a tremendous
positive upswing in attracting higher-density development in walkable and transit-
oriented areas, and opportunities for continuing this trend are aggressively pursued in
Norfolk’s planning and economic development efforts every day (such as Vision 2100,
Naval Station Norfolk Transit Extension Study, Military Circle Plan).
By having a better understanding of where the worst flooding occurs, we can
intelligently plan our land use strategies to make these areas green space or
infrastructure. The areas can become stormwater management zones to decrease our
runoff and pollution into the Chesapeake Bay and improve groundwater recharge.-
City of Norfolk Page 206Risks and Mitigation
City of Norfolk’s approach to assuring capacity and risk mitigations for its project relies on a rich
partner network that incorporates redundancy. The City will continuously identify additional
entities with capacity in critical areas and surface potential risks, and adjust as necessary.
In general, security challenges are magnified when dealing with Big Data due to its velocity,
volume, and variability. Many security issues are identified, such secure computations in
distributed programming frameworks, security best practices for non-relational data stores,
secure data storage and transactions logs, end-point I input validation/filtering, real-time
security/compliance monitoring, scalable privacy-preserving data mining and analytics (“Big
Brother”), cryptographically enforced access control and secure communication, granular access
control, granular audits, data provenance. Much research is being dedicated to these issues.
All of these issues are important for any Big Data collecting and processing activity but it quickly
becomes overwhelming to consider all of them at once. Hence, we will apply a separation of
concern principle by relying on the Cloud Services to handle security once the data are “in the
cloud”. However, the end-point input validation/filtering, scalable privacy-preserving data mining
and analytics (“Big Brother”), cryptographically enforced access control and secure
communication remain of concern and attention.
We propose to work closely with the Cloud services to define access control and data priority for
the possibility of (auto) tiered storage with different security policies. In addition we will seek to
partner with providers of input filtering technologies that will ensure the validity of inputs and
check for untrusted inputs sources in the multi-device environments, such as driver cell phones.
7Partners, Stakeholders and Governance Processes
The City of Norfolk has strong and long-standing relationships, that we consider partnerships,
with all of the public agencies that will be key players and stakeholders on this project. We also
have well-established relationships with our key university research partner, Old Dominion
University’s Transportation Research Institute, Norfolk Southern, Kimley-Horn, Siemens and
Midnight Status. We are excited to engage Metropia and Qualcomm, rounding out a core team
with an array of international expertise ideally suited for this project. Our Team:
Transportation Institute
-
City of Norfolk Page 21The portfolio of the Mobility Division includes signal and control technology for
rail-based passenger and freight traffic. Siemens RailFusion system will soon be deployed in
Norfolk improving rail/roadway operations. Electrification solutions for rail and road traffic. Road
traffic control and information systems, parking space management as well as electronic
payment and toll systems for urban and interurban traffic. Consulting, planning, financing,
construction and operation of turnkey mobility systems. Integrated mobility solutions for
intermodal networking of different traffic systems.
We are a group of transportation engineers, network modelers and data
scientists, all with solid academic backgrounds, practical experience, and a
passion for solving urban traffic congestion problems with creative, cutting-edge solutions. We
develop and integrate high-performance and mobile computing technologies to produce apps
and backend analytics capabilities that help both users (commuters) and entire systems (cities)
during normal operations, pre-planned special events, or unexpected, extraordinary
circumstances.
From reducing energy consumption, to cutting operational costs, to enhancing
public safety, we’re using our wireless expertise to transform infrastructure and
address the complex challenges that smart cities are facing. True efficiency is the result of
interoperability that allows data to flow freely across various technologies within city functions
such as lighting, transportation and infrastructure – enabling intelligent communication, while
maintaining security protocols. All of our citywide solutions are designed with the ability to scale
— meaning entire cities can be seamlessly connected no matter their needs today, or tomorrow.
Kimley-Horn (KHA) provides the team with ITS and smart transportation from
planning to design to software integration support activities. KHA’s civil and
electrical engineers understand the built environment coupled with software developers that
can translate that infrastructure/data into an intuitive interface, and mine the databases for
additional ways to enhance the way constituents get around. KHA is also apprised of recent
developments in the Automated and Connected Vehicle arenas, and is developing a research
roadmap on behalf of AASHTO and NCHRP related to planning and implementing Automated and
Connected Vehicle technologies (NCHRP 20-24),an integral part of Smart-Cities initiatives.
Midnight Status isa Norfolk-based software development company with over
20 years of experience. Its team members have created software for The
National Highway Institute, NATO, and the Marine Corps. Midnight Status has locally
developed and deployed ""Tunnel Traffic"", providing a simple smartphone interface for Hampton
Roads drivers to quickly see if any of the area’s four tunnels are blocked or congested.
Demonstration Governance
Governance processes involving demonstration projects require the knowledge to establish
proper procedures following the “rules of experimental conduct”, and the ability to strategically
-
City of Norfolk Page 22engage in inspection/observation throughout the process. It is desired that the “governing party”
have at least some level of independency from the “demonstrating party”. Our team provides
numerous entities possessing this knowledge, particularly our University Research unit partners.
We propose that our colleagues at the HRTPO serve as the governance lead. They will have little
direct roles in the concept developments and implementation, and they are experienced in the
role of operating as independent technical staff from the region’s cities, to remain regionally
objective. Their staff is already engaged frequently in the development of regional data
collection, evaluation and reporting, for example, the annual congestion report developed from
INRIX travel time data. VDOT has a somewhat similar “independency” relative to the City and can
support that role.
Our team would develop demonstration plans and processes initially, and submit them for
review and comment to USDOT, VDOT and HRTPO. Once the plans are finalized, any needs for
additional staff, maintaining independence, could be provided through on-call consultant
contracts, or by soliciting another University unit.
The main point is that given the breadth and depth of our team and partners, there will be
ample opportunities for developing such processes over what could be multiple independent
demonstration/testing exercises.
8Existing Transportation Infrastructure
a)Arterial Miles – 189
b)Freeway Miles – 22plus a 7 mile reversible HOV lane on I-64
c)Transit Services
Norfolk provides a robust family of transit
services including 21 local routes with
complete coverage of Norfolk’s arterial
system, 6 express routes, paratransit, a ferry
service connection to Portsmouth, and the
7.4 mile “Tide” light-rail line. A new
Downtown Transit
Center has just
opened. Most
buses are
equipped with AVL
tracking devices.
d)Shared Use Mobility Services
The City is pursuing a joint effort with
neighboring Portsmouth to implement a
bike-share service, targeted at 30 – 40 stations. Uber and Lyft are both operating locally.
-
City of Norfolk Page 23e)Information and Communication Technology
The City, along with our shared services partner Cox Communications, has a robust 10GB
Institutional Network (I-NET) fiber optic ring with 13 nodes that supports City facilities. We are
also in our first year of upgrading our I-NET infrastructure to 100GB. The wide area/metro
network has multiple connection methods, including owned/leased T1 services, Hybrid Fiber
Copper/Transparent LAN Services (HFC/TLS), Fast Ethernet and Gigabit Ethernet services at
various shaped bandwidths, and an OC-192 I-Net.
The City’s Advanced Traffic Management System (ATMS) communications platform is a fiber-
optic network with a topology of redundant distribution rings emanating from Sonet nodes
(replaced with Packet-Optical Transport Systems this year) arranged on a redundant backbone
ring (over 100 miles of fiber cabling). We are upgrading all connected signals with 8-port Cisco
Ethernet switches – 40 successful installations with 120 more deployments this year.
f)Intelligent Transportation Systems
The City operates 316 signalized intersections, 275 (with continuing expansion) in its ATMS
environment, which includes:, type 170 controllers, 90% Type 170 cabinets, 23 Cohu traffic
monitoring cameras, 16 signals integrated with LRT operations and signaling, QuicNet central
management software, several Sensys vehicle counter installations, and 20 lane-use *-blankout
signs. $3 million in funding has been allocated for a complete upgrade of the control platform to
ATC controllers with new local and system software.
Norfolk’s Traffic Management Center (TMC) is located in City Hall adjacent to Transportation
Division staff offices. The center is in the midst of upgrades to its video wall and server/switch
room along with a conversion of all video to IP. Video handling and camera control will be a
state-of-the-art system later this year, including the sharing of the City’s camera images on
VDOT’s 511 website. We are connected to VDOT’s regional Transportation Operations Center,
and will be to Elizabeth River Crossings’ new Operations Center when the tunnel upgrades and
expansion project is completed in 2017.
There are several Rapid Rectangular Flashing Beacon signals, some with active pedestrian
detection. The city is upgrading permissive left-turn phasing to 4-section FYA heads.
g)Smartgrid System
Three Electric Vehicle charging stations have recently been installed at City parking facilities.
Tesla has installed a charging station near I-64 in the eastern part of the city.
9Data Management and Sharing
Integrating the new level of transportation data will improve capabilities in some existing areas
of fleet or emergency management, simply by providing more accurate travel time prediction.
Routing first responders around an unknown road blockage could save a life. For other
possibilities a potentially vast array of utilities may be realized by “cross-pollenation”, replacing-
City of Norfolk Page 24some sources of frustration associated with transportation, with comfort and convenience. The
mere existence of smartphones allows people to “gain time”, but improved traveler safety and
predictability, plus “active” information to users, has the potential for changing behaviors, and
broadening a person’s “reach” to jobs, services, shopping and recreation – really anything.
Imagine stopping to have a cup of coffee with a friend you haven’t seen in a long time, because
the two of you were randomly and coincidentally passing near each other one day, and your
phone lets you know. Imagine you and your child’s day care being alerted simultaneously that
you’re going to be late, and without doing anything you get a message from them that a
neighbor with known permission has agreed to pick your child up so you don’t have to pay a
penalty, and the child gets to play with a friend while you are delayed. The possibilities and the
potential partners seem almost endless.
Recently, crowdsourcing and constant connectivity enabled by mobile sensing and computing
platforms (e.g., smartphones) spurred numerous remarkable innovations in many sectors of the
economy including the transportation sector. Companies like Uber and Lyft have leveraged the
mobile-phone platforms and provided new alternatives for taxi and ridesharing services that
disrupted the traditional business models. Metropia (a partner on Norfolk’s team) uses an app to
incentivize commuters for choosing departure times, routes, and modes so that traffic
congestion is reduced. All these applications and systems rely on constant communication and
mobile computing technologies to deliver the intended services. In particular, they rely on
smartphones which function as a key enabler and facilitate user interactions, user input, sensing,
data collection, computing, and communications. In 2015, 189.7 million people in the U.S.
owned smartphones (76.8 percent mobile market penetration). Given the continued increase in
smartphone market-penetration, the Norfolk team plans to develop various applications reliant
on mobile computing and sensing enabled by consumer electronics to address the mobility and
accessibility needs in the region. The City envisions building the necessary institutional and
technological components to create an environment where pervasive sensing and computing
play a central role to improve mobility and accessibility.
The City currently collects, stores, and maintains a variety of data related to this Smart City
Challenge. In addition to vehicle tracking of our public safety and fleet vehicles, we also have our
city facilities connected to building management systems to control energy consumption in real-
time. Outlined below are several key methods we currently collect data.
Verizon NetworkFleet: GPS driven fleet trafficking system on all City waste management trucks
and street sweepers. Onboard vehicle diagnostics, GPS tracking, and roadside assistance are
some of the features this system is used for.
Intergraph CAD: The City’s computer-aided dispatch (CAD) system, we can quickly answer calls,
create and update incident details, and manage multiple resources in real time. This system also
gives us the ability to track and route individual responders using mobile devices allows
dispatchers to view each person’s location, permitting real-time risk assessment.-
City of Norfolk Page 25Smart Parking Meter deployment will be completed by this Spring, connected to a data platform
usable for vendor parking payment and wayfinding applications.
Building Management Systems: The City currently operates three building management systems
developed by industry leaders including; Siemens and Johnson Controls.
311/Citizen Reporting Applications: The city currently has two in-house developed applications
to manage citizen requests and storm related events. Our Norfolk Cares Center (311 Call Center)
can take calls, emails, and requests submitted through a smart phone app. This data is cataloged
and tracked through the life cycle of the request using a custom developed application. STORM
(System to Track Organize and Map) is a custom in-house application that is also available to
residents as a mobile browser-based application. This application is used to report weather
related issues, for example; flooded streets, downed trees, blocked roads, and downed power
lines to name a few.
The City also works closely with regional partners and stakeholders on collecting and maintaining
import transportation related data and geographic information systems (GIS) data. The City is
currently working with ODU, HRPDC, HRSD, and other local governments on a grant proposal to
develop a regional GIS that can serve as central repository for accessing, downloading, viewing,
and analyzing geospatial related data. The local Code for America brigade also has developed
applications with the City, and an HRT bus/light rail finding application. This application gives
real-time information about HRT routes and schedules based on the user’s location information
from their smartphone.
Local and remote storage and processing facilities: To store vast amounts of data being collected
in the proposed activities instead of building in-house data centers, we propose to leverage data-
storage facilities at ODU for the dynamic data-driven processing and, eventually, remote web
storage, such as Amazon S3. Specifically, ODU has a 6-node cluster that runs Big Data processing
software including Hadoop and distributed file storage format HDF5. Specifically, each node has
two Intel Xeon E5-2670v2 processors (20 cores each @2.5GHz), 128GB of main memory, and
three 440GB SSD disks. The nodes are interconnected with Infiniband QDR HBA.
Data management software: To support data analytics and management, iRODS, which is an
open-source data management software governed by the iRODS concorsium, maybe employed.
Its services run on a variety platforms and have a high degree of scalability and availability.
High-performance network facilities: ODU is a partner in the Mid-Atlantic Research
Infrastructure Alliance (MARIA) which increases campus connections to the Internet2 Network to
100 gigabits per second (100G). This network infrastructure may greatly facilitate processing of
the collected data since MARIA connects many Virginia university campuses and feeds into a
broader interconnection network “Southern Crossroads” (SoX) a non-profit founded by Georgia
Tech and partners and is recognized as one the highest-bandwidth Internet gateways in the
South.-
City of Norfolk Page 26Through Norfolk’s big data platform, each stakeholder has the opportunity to use their preferred
analytics tools, through open standard access methods, to glean insights from the data and
suggest further operational improvements. Trusted information infuses processes bring people,
process and information to bear on further insights and continuous improvement to autonomy.
10Standards and Architectures
The City of Norfolk has been engaged in the deployment of ITS/ATMS infrastructure on a
consistent basis with using Federal funding for over a decade, whereby requiring compliance
with financial, environmental, and procurement guidelines. The City has been, and continues to
be, intricately involved in all regional ITS planning and architecture development with local
agencies and VDOT, including participation and leadership roles with the Hampton Roads
Transportation Operations subcommittee of the HRTPO. The City has an existing fiber optic
connection to the VDOT, and plans to integrate with a private bridge-tunnel facility in the near
future, to enable further regional collaboration.
Our project teammate Kimley-Horn with whom we have a long-standing relationship, brings
expertise in software development, system design, and integration support. Kimley-Horn is
developing a research roadmap on behalf of AASHTO and NCHRP related to planning and
implementing Automated and Connected Vehicle technologies (NCHRP 20-24), which will be an
integral part of Smart-Cities initiatives. Kimley-Horn’s experience includes developing Concepts
of Operations (Eastern Idaho Rural IntelliDrive) and Guidebooks (TMC Connected Vehicles for the
UVA Pooled Fund Study) for these upcoming technologies, developing software interfaces
(Dynamic Ridesharing product development support for Axiom xCell in San Diego), software
integration with Siemens and multi-vendor signal controller environment, as well as working
with the USDOT connected-vehicles safety pilot where Kimley-Horn’s KITS software monitors
signals in Ann Arbor that broadcast SPaT data to connected vehicles. Kimley-Horn is particularly
beneficial to Norfolk for the Smart-Cities program by being able to meld both hardware and
software design and implementation, coupled with technical operational and maintenance
support.
For a program of this kind, it will be important to document lessons learned. Under a recent
