	city	raw_text	clean_text	cluster_id
0	VA,Norfolk	"City of Norfolk, VA
*
Response Proposal to USDOT
Beyond Traffic: Smart City Challenge Grant
-
Table of Contents
1 City Challenges and Vision ..........................................................................................................1
2 City Characteristics .....................................................................................................................7
3 Other City Characteristics............................................................................................................8
4 Preliminary Site Map ................................................................................................................11
5 Holistic Approach to USDOT Vision Elements.............................................................................13
6 Risks and Mitigation .................................................................................................................20
7 Partners, Stakeholders and Governance Processes ....................................................................20
8 Existing Transportation Infrastructure.......................................................................................22
9 Data Management and Sharing.................................................................................................23
10 Standards and Architectures .................................................................................................26
11 Measurable Goals .................................................................................................................26
12 Capacity for Implementation.................................................................................................27
13 Leverage Opportunities.........................................................................................................28
14 Conclusion............................................................................................................................29
City of Norfolk Page 11City Challenges and Vision
The promises of the coming advances in transportation afforded by vehicle technology are
astounding. Changes in vehicle technology alone will improve safety and mobility in our city. But,
we have not been waiting idly – we have been on a continuous course of infrastructure,
operational and design improvement, and have more on the way; changes that are going to help
now, and facilitate the integration of the new. Our vision for Norfolk is innovative, yet
thoughtful, targeted, and bounded by rationality, as it should be. Our vision for this project is as
well, facilitating specific Norfolk-supportive outcomes, while strongly supporting national
research and development. We believe we can make strides for us and for the nation.
Norfolk is a coastal city blessed with extensive waterfront, a temperate climate, beautiful historic
neighborhoods, rich history, and tremendous diversity. Hampton Roads and the Elizabeth River
provide the best year-round harbor on the east coast, the world-class resource that has been the
driving force for this community for almost 400 years, and supports the world’s largest Naval
Base and several large commercial ports. Those very blessings, in addition to being the
constrained, older urban core city of the region, are also the source of major challenges for the
City.
Challenges
Norfolk cannot escape its relationship with the Atlantic Ocean, the Chesapeake Bay, the
Hampton Roads and the Elizabeth River, with the projected sea-level rise and resiliency
challenges they bring.
Three expressway tunnels; an interstate drawbridge; at-grade, under and
overpass railroad crossings; Light-Rail Transit; local/express bus and ferry
services; two interstates; and a Continuous-Flow Intersection – we have a
challenging transportation system as well. More details on our city, our transportation system,
and our wide range of aggressive resiliency initiatives are provided in Sections 3, 4, 5 and 8.
Almost without exception, if you ask people that live or work in Norfolk what they like least
about being here, one of their top two answers would be “traffic congestion”, inferring not only
delay but safety concerns. We want to change that, for the better and for good. But even as we
seek to change what is, issues are emerging that will dramatically impact our city and way of life.
As simple as “reducing traffic congestion” sounds, our vision requires context, and rests upon a
foundation of critical principles, that are important to our city, and many others. First, we are not
a rich city – in fact we are somewhat hampered with a large proportion of federal and state lands
that provide no local tax revenue. Our choices for spending must be very pragmatic and
targeted toward truly meaningful local benefit. Our solution will not be expensive to maintain
and operate, and it will leverage private and cross-needs support to maximize benefit-to-public
cost. Second, our planning focus is on “Vision 2100”, a major City planning initiative. We must
begin to face the 21stcentury challenges of being a historic, low-lying coastal city. We are
A Robust
Test Platform-
City of Norfolk Page 2planning for resiliency and transforming Norfolk even further toward a great live/work/play city
that maintains support for the state’s and nation’s economy and security derived from our
harbors. We know that transportation is a means for people and urban life, not an end. The city
of the future addresses safety, accessibility and sustainability, with support from allmodes of
accessibility. Third, we live in a world of rapidly changing technologies, and changing
demographics. We must serve an older population, while adjusting to younger generations who
won’t live and work in ways of past generations. We need to build tools that are adaptable and
agile. In short, we not only want our city to be smart, we want our approach to be smart .
Norfolk’s Vision is also influenced by a different relationship with climate change than may be
typical. That of a city, and road network, that will be seriously impacted by sea level rise, and while
not only learning to adapt and survive, must thrive. Our vision for planning and expenditures
must focus on long-term and lasting success – not quick fixes. After population decline to the
suburbs fairly typical of core cities in the latter 20thcentury, Norfolk’s population is rebounding
in this century in no small part due to an impressive array of City and private redevelopment and
investment. That continues and there is substantial land ripe for mixed-use redevelopment that
is pedestrian oriented, with access to bus and light-rail transit. Norfolk’s approach for reducing
oil reliance and carbon footprint is to incent a shift in regional population growth back to the
core, to renewed reliance on pedestrian, bicycle and transit travel, resulting in reductions of
annual VMT in the millions, according to a 2003 Smart Growth Analysis conducted by the
Hampton Roads Transportation Planning Organization (HRTPO).
In addition, while Norfolk continues to embark on an aggressive flooding prevention and
mitigation plan (see Section 3 for more details), we must deal with the reality of “managing” our
system, keeping our residents and visitors safe and sufficiently mobile, particularly for essential
services, during periodic flood events that are unavoidable. Coupled with other “reliability”
issues faced in our region due to limited connectivity and water crossings, we have the most to
gain by addressing non-recurring congestion. To wit, the HRTPO compiled national statistics of
similar-sized cities and found that this region fared very poorly in travel time reliability measures,
and further that this predominantly accounted for its comparatively high congestion ranking.
Our Vision for Addressing the Challenges of Mobility and Climate Change in Norfolk
Ultimately, the implementation of our Vision will have the following outcomes:
Safer Multimodal Travel – a result of actions at network/system level down to street conflicts
Facilitate Smart Growth, mode and temporal shifts, trip reduction – the overall reduction of
regional Vehicle Miles of Travel and greenhouse-gas emissions
Improved travel reliability – a key for our area, addressing the majority of our congestion and
barriers to synergy amongst the urban core cities, and the resiliency issues of periodic flooding.
Improved accessibility to jobs, goods, services and social life; mitigate the negative aspects of
urban travel through system management, information, smart land-use and digital accessibility.-
City of Norfolk Page 3With these critical foundational principles, and our “special” traits in mind, Norfolk proposes major
“Smart City” project efforts in three areas, all supported and interrelated by a fourth, a robust
information management system . This approach for the funding will address all Norfolk and
USDOT Vision Elements – more information on those particulars is provided in Section 5.
Key Project Area One : Develop Norfolk “Intelligent Mobility App” and Intelligent Sensing
Easy-to-receive-and-process, actionable information for travelers will be orders of
magnitude above current practice. We will build upon the great work of our partners.
Primary goals will include mode-shift and route/time-shift supportive information
Advance concepts of low-cost system data acquisition from existing, leveraged resources
Integrate intermodal and transit vehicle monitoring for traffic management functions
Leverage the tool by integrating other public and private services to “un-waste” time.
Expand to the “Intelligent Community Platform” as other service platforms evolve.
Key Project Area Two : Connected and Automated Vehicles Development and Testing Support
Norfolk has and is actively expanding/upgrading ATMS infrastructure that allows easy
installation of CV-related devices. “Real-Life-Issues” V2I testing and evaluation on
urbanized arterials should be happening nationally in this time frame and the City will
provide an outstanding test environment and support from local to international experts.
City staff will bring an important perspective as traffic signal operators and maintainers
that should enhance concept troubleshooting and testing design.
We will expand the “connected” concept to all users, not just vehicles, and to a broader
vehicle spectrum, through adaptations using DSRC technology in smartphones.
Our full proposal will elaborate on a collaborative R&D support approach consistent with
the current state of research. One certainty, we know that our approach must include
“change management” as the state of practice will undoubtedly evolve as we proceed.
More details on our system and proposed “test bed” are contained in sections 3, 4 and 5.
Key Project Area Three : Develop Active “Eco” Traffic
Operations Management Tools/Systems
We will focus first on high-impact strategies at
critical locations subject to extreme incident-
induced stress or impassable roads.
Innovative and flexible capacity-enhancing
intersection operations including variable cycle, phasing and lane-utilization strategies,
facilitated by the platforms of intelligent vehicles and sensing, and other partner systems.
Integration of Pedestrian, Bicyclist and Transit utility and safety enhancements. Norfolk is
a strong proponent and an ideal setting for Complete Streets and compact development.
Central System rapid-action signal management tools elevating TMC performance.
Visualization and active flow-chart based decision-support tools for operators (human
operators are still the most valuable tools in the box).Fulfillment Key Project Area
Outcome 1 2 3
Safety 
Mode/Time Shift 
Reliability 
Accessibility -
City of Norfolk Page 4“The Heart” – A Powerful and Agile Data Acquisition and Information Management System
Figure 1 illustrates the architecture of our proposed Transportation Information and Decision-
Support System. In short, the purpose of the system is to:
Collect data – convert it to a collection of intelligence – effectively put targeted information
into travelers’ possession for supporting both real-time and pre-trip decisions – similarly use
intelligence to take targeted real-time multimodal transportation system management
actions, with and without human interaction – and monitor system performance over time
for identification of potential operational and roadway improvement strategies.
The architecture could be described as having three “zones”. Moving from left-to-right, first we
have the Data acquisition zone – the points of data collection. They take widely varied forms and
require a variety of interface modules to pass the data to the “Analytics” zone, a series of
databases and processing/analyzing tools to create intelligent “use-case” information. This
information is then carried through various interfaces to the “edge-users” zone, a combination
of portals and applications supporting human and automated decision-support. This structure
lends itself to logical compartmentalization of objects that facilitates change and adaptation.
Details would include structured and documented interface mechanisms between objects.
An important note regarding the concept of “analytics” in the intelligent transportation world:
there are “on-street” and “remote”, or “system”, analytics. On-street analytics are the subject of
progressions in the connected-vehicle world and some advanced traffic controller operations.
This system is addressing the “remote” side – creating abilities to influence operational actions in
advance of events, as opposed to those that demand action in an immediate locale and time,
often safety-related, handled by on-street systems.
Several other concepts are noteworthy. 1) The Data zone incorporates extremely important
data capture from transportation partners, emergency services and the business community, as
well as travelers. Much of this information is of a less technical nature than “traffic” data
requiring participant input, and some will actually come into the system from the edge, e.g.
smartphone app. 2) The system relies heavily on strong participation through user smartphones
or similar devices. There will be concerns regarding privacy and security. We have no hesitations
about achieving sufficient participation. Benefits to users and secure system design, including
limiting the use of personal data in the system, will attract users. 3) There can be a tendency for
large systems such as this to become “black boxes”. At every level this system will include
reporting, visualization and dashboard type tools to support quality assurance and human
decision-making. 4) There is a huge role that Agency Operating Systems play in “end user”
impacts, much of which takes place within those individual control systems. The lines between
which applications do what may change, but in any event there is also a need to improve upon
operational actions taken, and these will also be addressed, regardless of the side in which they
reside. 5) It is crucial that the Open Data Portal doesn’t simply exist. Comprehensive “user tools”
will be created to facilitate the likelihood of third party interest and success.-
City of Norfolk Page 5
-
City of Norfolk Page 6Implementing the Smart Cities Challenge Demonstration Project
Importantly, our vision for this leveraged grant funding is outcomes of real value, both long and
short-term, and not just to Norfolk but to the entire country. Our project will be led by
transportation and urban activities professionals that understand human factors and the concept
of accessibility in promoting “smart” urban living.
For a project of this type a certain amount of “dividing and conquering” is a necessity as a
program management technique. Our team allows for efficiently segmented resource allocation
but also provides for redundant capabilities. The key project areas as we have defined them as
well as the three “zones” of the information system structure, fit nicely into allocations of
expertise and capacity over the entire duration of the project. It is expected that we will enhance
this arrangement moving forward, and of course the project will involve engaging contractors,
which the City does on a regular basis. In fact, the City’s practice of having highly capable
consultants and contractors “on call” with contracts will facilitate this process.
The program management plan will build upon the Project Management Body of Knowledge
(PMBOK). Kimley-Horn (KHA) will support the City of Norfolk in managing the proposed program
based on similar experiences working on expansive technology programs including Traffic
Adaptive signalization standards, the integration of KITS Mobile for Cyclists in Austin, and
similarly for Connected Vehicle research planning in NCHRP 20-24. As such the Program
Management plan will consist of managing scope, requirements, schedule, financial, quality,
resources, communications, project change, risk, and procurement. With the nature of this
multifaceted complex effort and range of team members and partners, managing resources,
communications, project change, and risk will be key focus areas. In addition, the City of Norfolk
and KHA will use certified Project Management Professionals (PMP) within the firm to review the
project management plan throughout the project.Sample Schedule and Tasks
Year 1Metropia installs current system, “jump starts” app development and data collection. ODU
leads cooperative effort with USDOT to identify V2X research opportunities. City leads early
agency partnership integration efforts, targets locations to develop new operating strategies,
team partners research the top video analytics currently available. Investigate sharing services.
Year 2Continue Data System development, particularly analytics. Develop “Eco” operati ng platform
concepts. Install field devices and begin V2I testing. Develop test sites for autonomous shuttle.
Develop plans for EV charging sites. Deploy real-time transit information systems.
Year 3Complete Data System and app development. Continue V2I testing. Implement autonomous
shuttle pilot. Develop selected Eco-traffic signal system utilities.
Year 4 Demonstration/Evaluation-
City of Norfolk Page 72City Characteristics
Norfolk is an independent mid-size city in the Commonwealth of Virginia, located at the core of
the Hampton Roads metropolitan area consisting of nine cities and seven countries. According to
the 2010 Census, Norfolk’s population totaled 242,803. Norfolk is Virginia’s second most
populous city and serves as the historic, urban, financial, and cultural center of Hampton Roads.
Norfolk has the highest population density in the region of 1.4 million - 4,363 people per square
mile according to the 2010 Census - twice the population density of all other cities in the region.
This represents 17% of the population of Norfolk’s local urbanized area. With 191,212 jobs, and
3,533 jobs per square mile, Norfolk is the region’s employment center with the highest job
density in the region.
Aside from being the hub of the Hampton Roads region, Norfolk is an international city that
hosts globally and nationally important assets. Norfolk and the region have a unique
interdependency with the military. The region is home to the largest concentration of U.S.
defense facilities in the world, and Norfolk is the home to Naval Station Norfolk, the largest naval
complex in the world, which supports the readiness of the Navy’s U.S. Atlantic fleet and drives
the economy and employment of Norfolk and the region. Nearly a quarter of the nation’s active-
duty military personnel are stationed in the region, particularly in Norfolk and a third of the U.S.
naval ship-building and repair capacity is housed there. The region is also home to the third-
largest commercial port on the East Coast that is projected to grow. Norfolk specifically hosts the
Port of Virginia’s Norfolk International Terminals, one of the city’s and the region’s most
significant economic assets, which makes Norfolk an integral node in national and global trade.
These two stalwart industries provide the foundation for the region’s economy. Department of
Defense spending supports over 40% of total regional employment. Over 8,000 service members
transition out of the military annually in the Hampton Roads region, providing the city with a
highly skilled labor force. In addition, the Port of Virginia handles over 81 million tons of cargo,
generates $60 billion of economic activity annually, and provides employment in port-related
industries for 343,000 Virginians. Norfolk’s population diversity also sets the city apart from the
region. While diversity is one of Norfolk’s most distinguishing attributes, it is also one of its
greatest challenges. Poverty levels are highly concentrated in some communities, and the
difference is even more significant by race and age. Relative to other cities in Hampton Roads,
Norfolk has the highest level of income inequality. More than half of Norfolk residents have low
to moderate incomes, with 19.2% living in poverty.-
City of Norfolk Page 83Other City Characteristics
a)Existing public transportation system.
Through Hampton Roads Transit, Norfolk supplies a robust network of public transportation
services, including local and express bus routes, para-transit, a ferry and light-rail (The Tide). The
Tide opened in 2011, and will be extended into Virginia Beach, attracting additional riders. An
EIS is about to begin for a transit extension to the Norfolk Naval Station. The City just opened a
$7 million Downtown Transit Center greatly enhancing system efficiency, connectivity to the
Tide, and access to downtown. All of these services are subsidized by the City (see Section 8).
b) Environment conducive to demonstrating proposed strategies
Norfolk is a national leader in the field of resilience and a fertile location for innovative solutions.
Due to its history of resilience, its demonstrated openness to innovations and ability to
transform when changing conditions require it, Norfolk was selected as one of the first resilient
cities in the 100 Resilient Cities (100RC) network by The Rockefeller Foundation. The two-year
100RC grant provides a wealth of resources, including funding for Norfolk's first (and world’s
third) Chief Resilience Officer (CRO) – an executive post supported by a cross-disciplinary team
reporting directly to the City Manager and Mayor, access to renowned international experts, and
membership in a cohort of global cities with similar challenges. Through 100RC, Norfolk and
other cities, such as London, Paris, and New York, are identifying, sharing, and institutionalizing
innovative resilience practices which inspire and support thousands of cities around the world.
100 Resilient Cities defines resilience as the ability of individuals, communities, institutions,
businesses and systems within a city to survive, adapt and grow, no matter the chronic stresses
or acute shocks they face. Norfolk defined the following resilience challenges through a
community engagement process—flooding and the long-term impact of sea level rise, and the
need to better connect vulnerable populations, among others. Surrounded by water with 144
miles of shoreline, low-lying and flat topography Norfolk’s among the nations’ most vulnerable
cities to coastal flooding. The city is experiencing the highest relative rate of sea level rise on the
East Coast, Norfolk and the region is second only to New Orleans as the largest population at risk
from sea level rise. As sea level continues to rise, severity of storm surge and extent of flooding
will continue to increase, posing significant challenge to residents’ mobility and mission
readiness of the U.S military forces and operation of water dependent industries.
Norfolk views these challenges as opportunities to transform in a more resilient way and show
the world how to thrive on the coast despite increasing risks. After two years of thorough
research, analysis and stakeholder engagement, Norfolk launched an integrated Resilience
Strategy to guide the city to be the successful coastal community of the future continuing its
business on the water in the environment of increased risk. The city intends to use the
opportunity to address environmental changes as a catalyst for diversifying the city’s economic
base and connecting individuals through new networks. In short, Norfolk believes that the-
City of Norfolk Page 9coastal community of the future will be a city that is more physically, socially and economically
connected.
Funding for Norfolk’s proposed U.S. DOT Beyond Traffic projects will support Norfolk in
implementing its Resilience Strategy, as well as collaboration with other cities and private and
public partners – including Naval Station Norfolk and Port of Virginia - all which have a high stake
in Norfolk’s success. Since Norfolk experiences these challenges earlier than others, solutions in
Norfolk - a nexus of trade for the eastern third of the U.S. and a security center for the world -
will help other cities on the coast to improve resilience. Finding innovative, smart city solutions
focused on reducing risk and improving data-driven decisions in coastal cities (while replicable
and scalable to any city) is critical because more than 80% of the nation’s economy is supported
in coastal states; nearly 80% of U.S. import and export freight is transported through seaports;
and more than 50% of the population and U.S. economic activity are in coastal regions.
