	city	raw_text	clean_text	cluster_id
As demonstrated in the leverage section of this proposal, Norfolk has already begun to create
this new city through a series of funded and leveraged initiatives. Norfolk’s capacity to pilot
innovative strategies was demonstrated in January 2016 when Norfolk was selected as the third
highest national winner of the HUD’s National Disaster Resilience Competition (NDRC), securing
$120 million to continue implementing strategies to design the coastal community of the future
and capture the resilience solutions in a new Resilience Accelerator discussed in Section 5 of this
proposal. The USDOT project would complement/benefit and be bolstered by this project and its
partnerships among many other supporting initiatives underway in the city and the region.
c)Continuity of committed leadership and capacity to carry out the demonstration
Norfolk has successfully implemented a variety of projects similar in scale, scope and complexity
to those proposed in this application. In the past three years, the City’s Public Works has
managed $267 million in infrastructure projects, including construction of the flagship Slover
Library and the Courts Complex. Slover Library is among the most technologically advanced
public libraries in the country. The state-of-the-art Courts facility is a LEED-certifiable
(Leadership in Energy and Environmental Design) green building. Phase I grand opening was in
January 2015 and now houses General District Court and Circuit Court. Phase II is underway and
is estimated to be completed in 2017.
Projects managed by the City of Norfolk follow a set of standards to initiate and manage
individual projects. This methodology provides tools for use by the project manager containing
definitions, guidelines, and templates needed to deliver successful projects. The methodology
establishes common ground for all projects within the organization and the standards in this
methodology serve as assets to each team member and provide a common format for evaluating
progress toward project goals, objectives, and deliverables. The methodology encourages a top-
down approach to project management. It ties directly to the project life cycle phases and
project initiation process flow to provide a more precise definition of projects, a common-
City of Norfolk Page 10lexicon used in project management, and a framework of activities mapped to each project class
size. It enables the tracking of progress against pre-determined metrics for reporting purposes.
d)A commitment to integrating with the sharing economy
The City of Norfolk is committed to integrating with the sharing economy demonstrated by the
development and support of the following initiatives:
The City developed a Bicycle and Pedestrian Strategic Plan, dated September 2015, and
initial implementation has included a Bike Sharing program.
Uber and Lyft are ride share services that are available and in use in the city
Hatch Accelerator, a public-private partnership startup accelerator program for
technology and entrepreneur community. This program launched in 2012 and continues
to be successful in growing entrepreneurial talent and retaining/ attracting that talent to
Norfolk.
Innovation Research Park, a collaboration between ODU and City of Norfolk that includes
business incubation and accelerator services to help companies in any stage of
development to achieve a competitive advantage.
City of Norfolk will launch a Coastal Resiliency Laboratory and Accelerator Center that will
serve as a nexus for technological, organizational and innovation around community
revitalization, water management, resilience measurement, port, Naval Station, and
other water-sector business related resilience challenges. Funding of $12 Million has
been allocated for this initiative.
The DOT Smart City Challenges Grant enables us to leverage our current sharing economy
initiatives and expand them to include: car sharing, autonomous vehicles, and data sharing. Data
sharing will open opportunities for the business and entrepreneur community in the following
areas: traffic management, nuisance flooding notification and avoidance, reuse and sharing of
services by citizens (peer to peer services), and health platforms to address patient
management. These innovations focus on the citizens rather than city process.
e)A commitment to making open, machine-readable data accessible, discoverable and usable by
the public to fuel entrepreneurship and innovation.
The City of Norfolk’s Chief Information Officer is developing our open data policy. Our open data
policy will provide a mechanism to break down the City’s departmental data silos and expose
important information to the public to better facilitate community engagement, transparency,
and build trust between the City and the residents it serves.
A vast variety and number of data sources are currently installed in the City, such as moving and
stationary sensors, and CCTV cameras. Coupled with the user interface data, such as cell phone
apps and text messages, as well as geo-location, the constantly growing data amounts may be
used to optimize flooded road management, public transit plan, predict congestion and flooding
impact on the road infrastructure and traffic pattern. Beyond the transportation impacts, the-
City of Norfolk Page 11data gathered during recurring flooding may be used to validate flood-prediction models
developed at the Virginia Institute of Marine Science (VIMS), help local entrepreneurs to gauge
the current customer needs, to fine-tune their operation hours, and to manage supplies.
Much investigation has been done recently in applying Big Data techniques to specific data sets
mentioned above. However, research into the integration of many data sets with diverse data
types to infer societal and economic impacts has just begun and is being enabled by emerging
public data storage and user access facilities as well as high-capacity network infrastructure. In
particular, data.gov portal contains a variety of data sets in many domains of interest to the
society. One possibility is to supply the transportation data being gathered by the City of Norfolk
with a similar meta-data structure so that it may be combined with existing data.gov data sets
using Big Data methods and---as an outcome of the data-collection activities---be housed in the
data.gov repository for the open public access.
In 2015, the City of Norfolk began working with Socrata, the global leader in software solutions
that is designed exclusively for a digital government. Socrata’s cloud-based Software as a Service
(SaaS) solutions supported by their Open Data network provide data driven innovation and
transform data into actionable insights for measurable cost savings. With Socrata’s Open Data
API and our creative commons license, developers and entrepreneurs can programmatically
access the City’s data for their own consumption and application development. Some datasets
we have on the Socrata open data platform are: (1) Call Center/311 requests; (2) Code
Enforcement Cases; and (3) Building Permits.
Also in 2015, the City launched our ArcGIS Online Open GIS data site to share our live
authoritative GIS data. The City’s Open GIS platform allows anyone to explore, visualize, analyze,
and share geospatial data to help solve real problems at no cost. Built using the ArcGIS REST API
the City’s Open GIS data site provides a simple, open web interface to our hosted map services.
The allows for multiple output formats to be consumed, including html (HyperText Markup
Language), json (JavaScript Object Notation), image, kmz (compressed KML, or Keyhole Markup
Language), and jsapi (JavaScript) to name a few. Some dataset groups we have on the ArcGIS
open data platform include: (1) Property Information layers; (2) Transportation; (3) Planning and
Zoning; and (4) Public Safety.
4Preliminary Site Map
Figure 2 contains several mapping images that help describe features relevant to the suitability
of Norfolk for providing an excellent site for USDOT’s investment. Key features illustrated on the
main map include tunnels, traffic signals, the Tide LRT line, and railroad crossings. A proposed
“test bed” for Connected Vehicle V2I equipment (further description in Section 5) is located.
Other sites shown include the two largest intermodal port facilities, Virginia International
Terminal and Lambert’s Point Coal Terminal, Naval Station Norfolk, and Old Dominion University.
The intermodal terminals are served by Norfolk Southern rail lines.City of Norfolk Page 12Figure 2
Test Bed
Figure 2. Preliminary Site Map
Tidal Inundation Tracking Application for Norfolk (City Developed)
Berkley Bridge Lift Span (I -264) Typical Railroad UnderpassWith TITAN,
residents can view
the impacts of a
predicted flooding
event
City of Norfolk Page 135Holistic Approach to USDOT Vision Elements
In Section 1 we discussed a Vision for Norfolk’s future, and key “project areas”. That Vision
reflects a very holistic approach to our City’s challenges, but the next “level” must delve into
more detailed objectives and strategies. This section provides elaboration, and addresses the
objectives of USDOT’s funding. These strategies continue to focus on achieving impact while
keeping costs low, thinking “beyond traffic”, and always remaining adaptable.
It is noteworthy that for every vision element there are inherent synergies with others, and in
fact necessary ones to achieve impacts, but also opportunistic ones that can cumulatively
increase impact. For example, data sensing alone accomplishes nothing. In keeping with our key
principles, we will seek to leverage synergies to multiply benefit and keep costs low .The efficient
and balanced integration of elements is critical to achieving maximum success.
The table below addresses our Vision’s alignment with each of the 12 USDOT Vision Elements.
Vision
ElementAlignment and Approach
ONE
Urban
AutomationThe City has numerous locations that are sure to benefit from the introduction of
“community” autonomous vehicles, in addition to general private fleet absorption. Two
college campuses, a downtown with residents and visitors frequenting its attractions,
the historic Ghent district, circulators for LRT and ferry patrons. Our proposed
information system is highly supportive of creating the intelligence platform for
autonomous vehicles in demand-based services and transit connection roles. Such
services could provide improved mobility at less cost . Support for V2X infrastructure
testing in support of is addressed below. Our Port and
Navy partners could have ideal applications.
The figure to the right illustrates a potential LRT station
feeder service connecting neighborhoods that are
separated from the station by highways. Norfolk’s own
staff or contracted resources could be utilized for the
application of pavement markings or other roadway
infrastructure to support pilots or testing.
TWO
Connected
Vehicles
(and other
users)Norfolk’s team will benefit from and build on the knowledge base accumulated over the
years from the USDOT’s Connected Vehicle (CV) test-beds and Pilot Deployment
Program around the country (e.g., Southeast Michigan, CV Pilot in NYC). Much has been
learned over the years, ranging from the development of systems for privacy protection
to standards for broadcasting SPaT (signal phase and timing) message from the RSU to
the receiving on-board equipment (OBE). There is much more yet to develop, test,
prove, and implement before these technologies, or elements thereof, are considered
“roadworthy”.
To provide an environment for showcasing and testing Connected Vehicles concepts
and technologies the Norfolk team plans to do the following:
The City will provide the base infrastructure for a comprehensive real-world arterial
system test-bed, that will include a continuous-flow intersection, a single-point arterial
interchange, a railroad overpass with adjacent signals, three interstate interchanges
-
City of Norfolk Page 14Vision
ElementAlignment and Approach
Connected
Vehicles
(and other
users)(one a 3 -interse ction tight -diamond with adjacent at -grade LRT crossing operated from
a single controller), Sensys volume counters, traffic monitoring cameras, all within a
contiguous 6.2 mile section of 4 to 10 lane roadways, with 36 Ethernet-connected
signals using 170 Type cabinets. The fiber channels throughout emanate from a Comm
field node located in our traffic maintenance building, in the corridor. The corridor is
identified in Figure 2. V2I RSU devices will be installed at locations as desired to
establish testing frameworks. After evaluating the literature and the lessons learned
from the CV test-beds and collaborating with USDOT, the team will identify numerous
CV applications that will be implemented and tested in the field (Red Light Violation
Warning, Pedestrian warnings and/or detection, SPaT messaging in complex urban
signal settings, etc.). Furthermore, the Norfolk team will coordinate with signal
controller/system vendors (e.g., Econolite) to expedite the implementation and testing
of Intelligent Traffic Signal Systems (I-SIGs) in the field where data from CV are
integrated and fused with data from traditional sensors for optimizing signal timing. CV
and remote data will allow predicting traffic patterns and enable proactive signal timing
to reduce congestion, improve transit service, and enhance overall intersection safety.
Given that DSRC-equipped vehicles are not yet common on the roads, the Norfolk team
suggests working with the industry leaders in wireless communications (e.g.,
Qualcomm) to test and implement alternative solutions.
Working with Qualcomm, equip smartphones with the DSRC capability as well as a
safety and mobility app. User interface and information provided to the user will
be optimized to minimize driver distraction.
Install after-market DSRC on test vehicles with the same safety app on cell phones
Install DSRC in signal cabinets and enable communication of SPaT with vehicles
and cell phones.
Lastly, to have a holistic system, the Norfolk team will make relevant data from CVs
available to the “cloud” to support other applications that do not necessarily rely on
DSRC. For example, an emergency vehicle (EV) with a DSRC can transmit its location,
route, and destination to vehicles in its path and to an RSU which then sends this
information to the cloud. CVs and others with a smartphone app in the immediate area
of the EV would receive a message with exact details about the EV’s route, which will
help vehicles and pedestrians clear paths for the safe passing of the EV.
The team would expect to advance the state of R&D in the CV arena, while also creating
current improvements for operations and safety in proximity to signalized intersections.
THREE
Intelligent,
Sensor-Based
InfrastructureConsistent with our stated Vision, our approach definitively is designed for maximum
impact at reasonable life-cycle costs. In Norfolk’s Vision, smartphones, or more
generally mobile consumer devices, will play a central role as a sensing and
communication technology. There are numerous motivating factors for this: (i) The
proliferation of mobile devices with ever-increasing computing, sensing, and
communication capabilities; (ii) The ability for rapid deployment and ease of software
updating with the current App-store system; (iii) The ability to collect a large-amount of
data at a very low cost; (iv) The ability to collect travel data across all modes of
transportation;.and (v) the potential to extract rich traveler information from both GPS-
City of Norfolk Page 15Vision
ElementAlignment and Approach
Intelligent,
Sensor-Based
Infrastructureand low -energy inertial sensors (i.e., accelerometers, gyroscopes, compass) within the
smartphones. From the rich sensor data, beyond extracting trajectories of travelers, it is
possible to detect the mode of travel (see figure), vehicle operating mode (e.g., idling,
accelerating), and the amount of time spent within each mode. Such information, which
currently does not exist at a large scale, will be invaluable for accurately estimating GHG
and other emissions. Furthermore, by relating such data to links and nodes of a
transportation network, the system operators can determine areas with inefficient
operations and higher emissions.
In addition, with the recent advancements in chipsets technology provided by
Qualcomm – a partner on Norfolk’s team) it is now possible to have dedicated short-
range communications (DSRC) technology on smartphones. This will enable
smartphones to serve as a medium for communications among vehicles, pedestrians,
and infrastructure to support various safety and mobility applications.
Streaming video from traffic monitoring cameras (already the most powerful tool in an
operator’s arsenal) is currently an underutilized resource, usually providing no direct
value over 90% of the time. We propose a ”multi-purpose” camera system that uses
visible and thermal imaging; PTZ, detection and 360 degree cameras; and powerful
video analytics platforms, to leverage the already-supported systems into a data-
production monster. (of note: relatively inexpensive camera systems are readily
maintainable by existing traffic signal maintenance labor forces) This system could
produce in addition to standard traffic data, both real-time and historical, movement
data on the entire user cross-section, O-D/route data, security, road surface and
weather conditions. Norfolk’s efforts in establishing a system-wide high-capacity
Ethernet platform can support the data transmission requirements for this approach.
The nature of the system also is less “black-box” since performance can be observed at
any time, enhancing troubleshooting.
The City plans to develop a comprehensive set of tools to estimate water inundation
levels due to flooding through crowdsourced images, video surveillance images if
available, and a network of gauges or sensors. A custom smartphone app will be
developed to enable citizens to collect and upload inundation image data in real-time.
CV V2I sensing has been addressed.
-
City of Norfolk Page 16Vision
ElementAlignment and Approach
FOUR
Urban
AnalyticsThis element involves converting captured “data” into a variety of “products”. There is a
distinction because we must do all three of these: take actions, provide actionable
intelligence to users and our operating systems, and provide “useful” information to
third-parties that will also provide benefits and help support the system. Figure 1
illustrated the need for a variety of “analyzers”, having different functions, as you move
from data at is source to product. Each one is unique, of a different flavor, requiring
different constructs and skills. We are literally walking through the door of the data-rich
environment of the future, requiring different thinking than the past. With the sheer
volume of data and the complexity of the intelligence to be mined and produced, this
may be one of the biggest “big data” challenges to date. The science of “big data”
analytics requires cleverness in how data is housed, in computational techniques of
algorithms, digital and spatial analysis, and in user delivery. This we understand and
bring all of the requisite skills to the table.
We’ve got to “meld and supplement” source data using statistical and spatial
techniques to develop our total state conditions over-and-over again for our real-time
moving picture., and craft the “agent” forms (an intelligent representation) of data that
are easier to “mine” by the downstream analyzers. For example, a downstream analytic
may compare two spatial (2 or 3 dimensional) dataset agents looking for a significant
change. Agent datasets may reflect conditional variances from a norm rather than
actual values. Archived libraries of historical actual and agent datasets can form the
basis for models using advanced techniques such as pattern recognition and machine
learning. Our private and research institute partners bring ready experience in these
areas.
The obvious analytic goals for traffic operations professionals are things like: predicting
multimodal traffic flows, particularly in light of non-recurring events such as crashes,
work zones, impassable roads and special events; identifying crashes or hazards in real
time and facilitating responders; and creating tools for actionable operational
adjustments, whether by automation or human operator, such as traffic signal/
intersection operations adjustments for incidents, transit or emergency responders, or
on their side, transit scheduling adjustments or dynamic emergency vehicle routing.
Extremely important although less complex, analytics for “app” users are a “new
frontier”, both on the public side and how private partners are leveraging the
information. With a diverse population of users, a “one-size-fits-all” approach cannot
suffice. The user analyzer should be multi-dimensional with say, a vertical spectrum of
user participation level and a horizontal level of user preferences. The more
participation from a user, the more benefit they can obtain.
Our combined system of sensing, urban analytics and open data creates a “synergy
magnet” which will induce multi-partner and service breadth, and will be scalable up to
grow with opportunities and needs.-
City of Norfolk Page 17Vision
ElementAlignment and Approach
FIVE
User-Focused
Mobility
Services and
ChoicesOur approach will focus on the needs of all users, regardless of age, ability, ethnicity,
race and income - in particular users with disabilities, and older users, require choices
and alternative services and treatments. Technology and the coming Intelligent
Community Platform will revolutionize accessibility choices. The Mobility app will have
ultimate power and flexibility for users to exercise choice from the entire spectrum of
options, whether based on real-time or historical information, or personal vs. shared
mobility options. Users will be able to set their own preferences for their level of
participation. Through strategic business partnering, the mobility service provider world
will have ease of successfully deploying in Norfolk at its fingertips.
A current and evolving example in Norfolk is the implementation of Smart parking
meters downtown. The data platform connected to the meters opens the door for
parking app vendors (we are currently using Passport) that can supply a host of user
utility improvements, such as simplified payment, time expiration notifications,
automated validation or discounts by businesses, and the locations of open spaces. The
“larger” impact of such platforms is removing some of the “disutility” associated with
patronizing downtown businesses, improve downtown’s vitality and success.
SIX
Urban Delivery
and LogisticsTrucks create a challenge for efficient traffic signal operations due to their different size
and acceleration characteristics. V2I infrastructure at the south entrance to VIT could
improve intermodal operations at the port.
The transportation information system contains within it the network travel time
information that is needed to support everyday logistics, but also would include a
service coordinated through the User and Trip Planner analyzers, and the Partner Portal
to support consolidated delivery services. The City’s Economic Development
Department would work with potential “vendors” to purchase or lease a suitably
located piece of land for a storage/transfer site.
We will seek to deploy logistics-driven solutions, which could include autonomous
vehicles, at Virginia International Terminal to leverage all of the space available on the
constrained site.
SEVEN
Strategic
Business
Models and
Partnering
OpportunitiesAs demonstrated in Section 7 and 13, the City leverages an extensive network of
partners and stakeholders in identifying and developing business opportunities..
Illustratively, the City and its partners will leverage a new $12M-funded Coastal
Resiliency Laboratory and Accelerator Center to capture a portion of the new resilience
market by connecting “smart city” and other resilience challenges with solutions and
products. The Accelerator will also ensure that best practices and lessons learned get
captured and disseminated within the region, nation and world.
Business partnering opportunities leveraging the data platform will be facilitated by
designing high utility and ease-of-use into the open data portal. The City has a robust
and aggressive Economic Development Department constantly seeking and recruiting
businesses and entrepreneurs into the City.
The City offers prime downtown real estate at no cost for an entrepreneurial start-up
organization called Hatch. Hatch offers a variety of tools and resources to help
companies at almost any stage accomplish their goals. We create the ecosystem for
entrepreneurs to thrive by building platforms, programs, events, and courses designed
specifically for early stage and small businesses to pick up with ease and flourish.-
City of Norfolk Page 18Vision
ElementAlignment and Approach
EIGHT
Smart Grid, and
Electric Vehicles
(EVs)Dominion Virginia Power is actively deploying smartgrid technology systemwide.
The City’s likely contribution to this element would come in the form of EV charging
stations and “park-n-charge” sites. Driving on Norfolk City streets rarely involves more
than 8 miles, or 20 minutes, of travel. The City has recently collaborated with Virginia
Clean Cities to install three charging stations (2 in downtown) on City property. Tesla
has also recently installed a charging station in the City.
With ownership of 20,000 downtown parking garage spaces, the City is extremely well-
