	city	raw_text	clean_text	cluster_id
effort assisting the City of Norfolk with migrating from their serial communications network to an
advanced Ethernet platform, Kimley-Horn developed a testbed in the City’s TOC network room,
prepared a test plan, secured network hardware from multiple vendors, and implemented the
test strategy and compiled a full document of the procedures, outcomes, and recommendations
for subsequent deployments. The lessons learned from this testbed, and the first pilot field
deployment were documented and used for conversions of subsequent field communication
channels to Ethernet.
11Measurable Goals
When we think about Norfolk’s primary vision and goals, they are predominately for long-term
success. In the complex world of urban activity and transportation it is very difficult to isolate-
City of Norfolk Page 27multimodal performance metrics from which one can glean success or failure over that time
frame. The important concept of a “controlled experiment” is almost unachievable. Defaulting to
“easy-to-collect” metrics that are not comprehensive, can’t discern multivariable contributions,
and only measure short-term changes, to force the issue, can actually have damaging effects.
But, one of the great gains in this new data paradigm is a comprehensive data picture that has
not previously existed, therefore addressing some of those issues. Our approach is going to be
thoughtful, use proper experimental design techniques, and importantly, promote learning.
One of the goals of the Transportation Data System is to archive a robust recurring knowledge
state in the Archived Intelligence database. The design of its structure, most importantly to serve
the needs of analytics based on empirical data, will equally well serve the needs of the most
robust performance monitoring system ever devised. However, we can even do one better – we
can create intelligent self-monitoring tools within the analyzers, which can report on activities
that would have some expectation of a possible impact, and in some cases have automated
retrieval and storage of pertinent data sets following the actions.
Metrics will include: Travel Time and Reliability (all user populations), Network density,
Effectiveness of information – evaluating choices, Transit ridership and service metrics, Route
diversion frequency and utility, User satisfaction (app will facilitate surveys), Business/
development trends, cost-effectiveness, and crashes. With respect to crash data, it is
noteworthy that our proposed systems will begin to greatly elevate data in support of safety
analysis – a new paradigm of crash history assessment will be possible.
An important point project-wise is that comparable “before” data will be collected in the 2ndand
3rdyears of the project so that demonstration data (and beyond) will be meaningful.
12Capacity for Implementation
Norfolk has been in the forefront of technology implementation and is recognized as one of the
national leaders in the field of resilience. Situated in the heart of the defense corridor, Norfolk
has been partnering with key defense contractors and other technology leaders to transform the
city into a smart city, serving its large diverse population and improving the quality of life for
vulnerable residents. Norfolk has a long record of successfully implementing a variety of projects
similar in scale, scope and complexity to those proposed in this application. Illustratively, in the
past three years alone, Public Works has managed $267 million in infrastructure projects,
including construction of the flagship Slover Library that was recognized as one of the most
technologically advanced libraries in the U.S. Similarly, in the past two years alone, the City’s IT
department developed and launched in-house more than 10 software application, regularly
supports and operates over 100 of them and scaled up its city-wide network, all in partnership
and coordination with local private and non-profit partners and stakeholders. The release and
implementation of our holistic Resilience Strategy, hire of Chief Resilience Officer and Chief
Marketing Officer and institutionalization of a Resilience Office that serves as a connector and
aligner of efforts and opportunities within the City, and between the City departments and-
City of Norfolk Page 28external partners, demonstrates Norfolk’s overall capacity and executive commitment to take on
the proposed project.
Importantly, the City’s internal capacity to embark on projects of this magnitude, complexity and
level of innovation is significantly enhanced by proven partnerships with an array of cross-
disciplinary, public, private and non-profit stakeholders which will work with the City to
implement the proposed projects and provide necessary redundancy to mitigate potential risks
(See Section 7 Partners). Furthermore, the partnerships for this proposal will build on and will
leverage a regional public-private coalition established around the HUD’s National Disaster
Resilience Competition application development and Norfolk’s concurrent Resilience Strategy
development process. Both efforts brought together nearly 100 multiple state and federal
agencies (including the Navy and Commonwealth’s agencies), local governments, institutions of
higher education, regional planning organizations, community groups and private sector
partners to develop and now implement innovative resilience projects at the local level.
13Leverage Opportunities
While other cities benefit from the head start in the field of autonomous vehicles, electric
vehicles, shared economy services or vehicles to vehicles/vehicles to infrastructure technology,
Norfolk has already made significant investments in designing coastal community of the future -
a city that can survive and thrive in an environment of rising sea level and uses the opportunity
to address environmental changes as a catalyst for diversifying the city’s economic base and
connecting individuals through new networks. Because cities are systems of systems, continually
interacting, influencing and impacting one another, policies and actions designed to influence
one system impact, for better or worse, others. Our approach to resilience-building embraces
this interaction recognizing that investments in any system creates opportunity for returns in
improvements in multiple systems. To address our vulnerabilities and challenges in ways that
make the city and broader region truly smart, resilient city, the work proposed in this application
will simultaneously strengthen our physical, social and economic resilience while benefiting from
the existing partner networks and current and committed investments in building the coastal
community of the future.
For instance, in partnership with the Navy, U.S. Army Corps of Engineers, Port of Virginia, The
Rockefeller Foundation, White House-sponsored Intergovernmental Pilot Project led by Old
Dominion University, local community organizations and planning district commissions, Norfolk
is launching a series of holistic studies and projects to redesign land use by watershed to more
innovatively use green, blue and grey infrastructure to manage recurrent flooding and sea level
rise to ensure that the city’s and region’s residents and key economic assets that rely on
unimpeded access and reliable transportation networks can continue to thrive on the coast.
Similarly, Norfolk has been heavily investing in live-work-play-stay placemaking, “attract and
retain” projects and app tools as part of its strategy to design the economically, socially and
physically more connected coastal community of the future that can adapt to and take
advantage of changing conditions. These investments encourage people and businesses to move-
City of Norfolk Page 29“beyond traffic” by living closer to where they work instead of putting pressure on the City’s
limited resources to invest in costly transportation infrastructure not always suitable for coastal
communities facing changing conditions associated with flooding and sea level rise. Current
overhaul of zoning code, investments in light rail and its future extension through flood-free
areas, new bike lines, bike share program, complete street policy, investments in shared work
spaces, extension of fiber network, innovation centers, and access to early stage capital for
entrepreneurs to incubate new ideas are just a few examples of these efforts that will be
leveraged for the proposed project.
Illustratively, the proposed project will benefit from the recently awarded $120 million National
Disaster Resilience Competition grant to accelerate Norfolk’s effort to design the coastal
community of the future. Norfolk in partnership with the Commonwealth of Virginia and a
consortium of private, public and non-profit partners, including Old Dominion University, will use
$5M of these funds to establish a Resilience Lab/Accelerator to serve as a connector between
“smart city” problems, solutions, and market for the region’s resilience challenges – with
transportation-related challenges being a major area of focus. Norfolk will also leverage
connectivity-enhancing investments including, over $7M in federal funds to study corridors for
the Naval Base LRT extension, $175M for the Intermodal Connector project, up to $750K to
construct a bicycle loop, up to $500K to improve pedestrian crossings, over $3 million to extend
broadband/fire optic, and over $55M in wealth of research in Intelligent Transportation Systems
(ITSs), connected vehicles, big data, multi-modal transportation operations and planning,
unmanned aerial vehicles, and other related areas to improve the safety and mobility of
transportation systems provided by the partnering universities – Old Dominion’s Transportation
Research Institute and Virginia Tech’s Transportation Institute.
14Conclusion
Norfolk would be an excellent choice for the “Beyond Traffic: The Smart City Challenge” grant.
It is critical that the funding serve to advance the state of research, testing and practice in key
technology areas such as automated and connected vehicles, and sensing. We would provide all
of the resources necessary with our team, and we have ideal, challenging test bed opportunities.
Norfolk has challenges both long and short term that it intends to address with the funding. The
outstanding low-cost approaches and tools that it would develop for meaningful short-term
impact would be designed for easy transferability to other cities.
“Addressing climate change” takes on greater meaning in Norfolk, a city threatened by sea-level
rise, a member of 100 Resilient Cities, and home to a nationally critical military presence. The
benefits to be realized here are larger in magnitude and scope.
Norfolk is extremely committed to developing coastal resiliency strategies, which must involve
